{
  "schema_version": 1,
  "request_id": "example-real-gap",
  "project_id": "example-project",
  "revision": "local",
  "mutant": {
    "mutant_id": "m-example-001",
    "operator": "comparison_gt_to_ge",
    "operator_version": "1",
    "source_path": "src/decision.py",
    "function_id": "decision.decide",
    "class_name": null,
    "line_no": 2,
    "column_no": 9,
    "original": "x > 3",
    "replacement": "x >= 3",
    "diff": "- x > 3\n+ x >= 3",
    "status": "survived"
  },
  "source": {
    "source_path": "src/decision.py",
    "source_sha256": "a77e8c6f33f7fa1f179d114be712c1970f4b17a89edf5a542962206409aa44d0",
    "source_text": "def decide(x):\n    if x > 3:\n        return True\n    return False\n",
    "function_source": null,
    "function_start_line": 1,
    "function_end_line": 4
  },
  "selection": {
    "selected_tests": ["tests/test_decision.py::test_high_value"],
    "related_test_nodeids": [],
    "runtime_location_reached": true,
    "mutated_branch_reached": true,
    "boundary_values_observed": true,
    "truth_table_observed": null,
    "oracle_observed": true,
    "assertions_observed": true,
    "equivalent_observation": false,
    "reachable_paths_proven": true,
    "static_reachability": "reachable",
    "observed_effects_changed": true,
    "selection_reasons": ["coverage"]
  },
  "executions": [
    {
      "execution_id": "exec-example-001",
      "level": "selected",
      "status": "survived",
      "exit_code": 0,
      "timed_out": false,
      "infrastructure_failure": false,
      "restore_verified": true,
      "selected_tests": ["tests/test_decision.py::test_high_value"],
      "observed_tests": ["tests/test_decision.py::test_high_value"],
      "output_excerpt": "1 passed"
    }
  ],
  "related_tests": [],
  "related_dependencies": [],
  "environment": null,
  "requested_modes": ["classify", "propose"]
}
